Unnamed: 0,id,author_id,text,is_retweet,content
75,1517255286662213632,15473958,"A podcast about little ol me 
The latest episode of the On A Mission podcast focuses on yours truly So put on your favorite headphones and learn about the discoveries me and my team have made the challenges weve faced and whats next for me ",False,"A podcast about little ol’ me? 😊
The latest episode of the “On A Mission” #podcast focuses on yours truly. So put on your favorite headphones and learn about the discoveries me and my team have made, the challenges we’ve faced, and what’s next for me. https://t.co/icbMjSKqZi"
76,1512141703066505236,15473958,On March 18 my team on Earth saw the rough terrain I had ahead based on images I took and thats when they decided to reroute me,False,"@FrancoCerioni On March 18, my team on Earth saw the rough terrain I had ahead based on images I took and that's when they decided to reroute me."
77,1512134149183705088,15473958,"Ive gotta protect my wheels 
After spotting some gatorback rocks Ill be taking an alternate path as I continue to explore Mount Sharp The windsharpened stones could cause serious damage to my wheels so its best to avoid them  ",False,"I've gotta protect my wheels 🛞
After spotting some “gator-back” rocks, I’ll be taking an alternate path as I continue to explore Mount Sharp. The wind-sharpened stones could cause serious damage to my wheels so it’s best to avoid them. https://t.co/8RWUpSc9Rn https://t.co/4u0RvHLLrg"
78,1511831874536046593,15473958," NASAJPLCaltechSpace Science Institute

More on this image at ",False,"📷: NASA/JPL-Caltech/Space Science Institute

More on this image at https://t.co/qyBRMwTHhG"
79,1511817845272768512,15473958,"Did it get dark in here Oh thats just the dust cloud I caught with my Hazcam While this isnt the first dusty gust Ive captured its size and proximity made for a dense shadow 

 from sol 3418 ",False,"Did it get dark in here? Oh, that’s just the dust cloud I caught with my Hazcam. While this isn’t the first dusty gust I’ve captured, its size and proximity made for a dense shadow. 

[📷 from sol 3418] https://t.co/CgnWIhqqSQ"
80,1504250365343985667,15473958,Im exploring a new spot on Mount Sharp  and I even found some cool concretions See what I and my sol sister have been up to on Mars ,False,I’m exploring a new spot on Mount Sharp - and I even found some cool concretions. See what I (and my sol sister @NASAPersevere) have been up to on Mars. https://t.co/Hm5GEREhVI
81,1501324062760468482,15473958, Who runs the red world Girls  Today is InternationalWomensDay so Im giving a special shoutout to the women on my team You rock my world literally ,False,"🎶 Who runs the (red) world? Girls! 🎶 Today is #InternationalWomensDay, so I’m giving a special shoutout to the women on my team. You rock my world… literally! https://t.co/aWt16SgJVt"
82,1498461585353834499,15473958,I spy with my handheld imager MAHLI this beautiful fragile and tiny feature Its a concretion eroded from sedimentary rock that was cemented by mineralrich groundwater Size Just 1 cm  ,False,"I spy with my hand-held imager (MAHLI) this beautiful, fragile and tiny feature. It’s a concretion, eroded from sedimentary rock that was cemented by mineral-rich groundwater. Size? Just 1 cm. https://t.co/753z6Q4Oqx https://t.co/dCHtZs3IAR"
83,1494356118696443905,15473958, Just clouds drifting through the Martian sky These wisps were 50 miles 80 km above me amp the height suggests theyre made of carbon dioxide ice These digitallyenhanced images from one of my navigation cameras were put together into 8frame GIFs  ,False,☁️ Just clouds drifting through the Martian sky. These wisps were ~50 miles (80 km) above me &amp; the height suggests they’re made of carbon dioxide ice. These digitally-enhanced images from one of my navigation cameras were put together into 8-frame GIFs. https://t.co/msDbzywWMP https://t.co/Rwhaot29nq
84,1492903671146844163,15473958,"To My Galentine Thanks for joining me in trailblazing new paths for understanding our universe Exploring uncharted territory is a bit easier knowing a friend shares the same world

GalentinesDay ",False,"To: My Galentine @NASAPersevere 

Thanks for joining me in trailblazing new paths for understanding our universe. Exploring uncharted territory is a bit easier knowing a friend shares the same world.

#GalentinesDay https://t.co/GlU9nGli7n"
85,1491486543701184512,15473958,Earlier in my mission I checked my wheels every 500 meters Theyre holding up well enough that my team now only has me check them every 1000 meters Their lifespan and odometry remaining is expected to support me through the remainder of my mission on the Red Planet,False,"Earlier in my mission, I checked my wheels every 500 meters. They're holding up well enough that my team now only has me check them every 1,000 meters. Their lifespan and odometry remaining is expected to support me through the remainder of my mission on the Red Planet.✨"
86,1491486322162237442,15473958,My team has provided me with upgrades like my traction control algorithm which are extending the life of my wheels ,False,"My team has provided me with upgrades like my traction control algorithm, which are extending the life of my wheels: https://t.co/lOhcLTlw1O"
87,1491486278851776515,15473958,The Martian surface can be rocky sharp and unforgiving  so after nearly 10 years my wheels have taken a beating The good news is that this is not impacting my mission ,False,"The Martian surface can be rocky, sharp, and unforgiving – so after nearly 10 years, my wheels have taken a beating. The good news is that this is not impacting my mission. https://t.co/1UvP43pTBt"
88,1489650492179288066,15473958,Is there a competition for rock mining and sand scooping in the WinterOlympics Could one participate remotely If so I may have a shot I hold the record for most number of drill samples collected on another planet  34  plus six scoops of sand Thats 40 samples analyzed ,False,"Is there a competition for rock mining and sand scooping in the #WinterOlympics? Could one participate remotely? (If so, I may have a shot!) I hold the record for most number of drill samples collected on another planet – 34 – plus six scoops of sand. That's 40 samples analyzed! https://t.co/zjgGXl5pUW"
89,1483490775593668608,15473958,Curiouser amp curiouser I found samples with unusual carbon isotopes which are key in understanding the evolution of planets On Earth this is linked to life but it may still be created by geology What does it mean on Mars Ah thats the great puzzle  ,False,"🧐Curiouser &amp; curiouser! I found samples with unusual carbon isotopes, which are key in understanding the evolution of planets. On Earth, this is linked to life but it may still be created by geology. What does it mean on Mars? Ah, that’s the great puzzle! https://t.co/xLKj8QmEL9 https://t.co/L3Gf8oFctP"
90,1478497396799672323,15473958,The Roraima quadrant is named after the northernmost state of Brazil and Mount Roraima which is the highest peak in the Pakaraima mountains which sits between Brazil Venezuela and Guyana,False,"@judibana @NASAMars The Roraima quadrant is named after the northern-most state of Brazil and Mount Roraima, which is the highest peak in the Pakaraima mountains which sits between Brazil, Venezuela, and Guyana."
91,1478497059221110784,15473958,I am looking back You can see all the way to the Torridon quadrant and see Mars Scottish highlands with a beautiful view of the Maria Gordon notch you can also see the rim of Gale Crater in the distance ,False,@nvuono @NASAMars I am looking back. You can see all the way to the Torridon quadrant and see Mars’ “Scottish highlands” with a beautiful view of the Maria Gordon notch; you can also see the rim of Gale Crater in the distance! 😍
92,1478492137981300736,15473958,New year new view I made it to a mapping quadrant called Roraima Its named after the northernmost state of Brazil and Mount Roraima The terrain in the Roraima region on Earth is similar to this area on Mars  flattopped hills and some steep slopes  ,False,"New year, new view. I made it to a mapping quadrant called Roraima. It’s named after the northern-most state of Brazil and Mount Roraima. The terrain in the Roraima region on Earth is similar to this area on Mars – flat-topped hills and some steep slopes. https://t.co/AqnMGPjrH0 https://t.co/ZXeJV6MSRI"
93,1468331272233635840,15473958,The cliff is 39 feet 12 meters tall,False,@PeterNemere The cliff is 39 feet (12 meters) tall.
94,1468328562461532161,15473958,"You are so beautiful to me  
Im getting ready to rove through Maria Gordon Notch in the coming sols Im traveling to the edge of the valley so I can study the composition of that tall cliff you can see to my right  ",False,"You are so beautiful to me 🎶 
I’m getting ready to rove through “Maria Gordon Notch” in the coming sols. I’m traveling to the edge of the valley so I can study the composition of that tall cliff you can see to my right. https://t.co/jRgHisPh1M https://t.co/JlC1bP6E8a"
95,1467261994075975681,15473958,Not only has inspired humans shes inspired robots like me to boldly go where no robot has gone before  ,False,"Not only has @NichelleIsUhura inspired humans, she’s inspired robots like me to boldly go where no robot has gone before 🖖 https://t.co/8qmfwp6ZNg"
96,1466174308678438913,15473958,Woo you can say that again sister Mars landings are no joke ,False,"Woo, you can say that again, sister. Mars landings are no joke! https://t.co/yFqEZQfzlI"
